{
  "storage_name": "eap_items",
  "rows_to_delete": 1000,
  "conditions": {
    "organization_id": [1],
    "project_id": [1],
    "trace_id": [
      "550e8400-e29b-41d4-a716-446655440000",
      "6ba7b810-9dad-11d1-80b4-00c04fd430c8",
      "f47ac10b-58cc-4372-a567-0e02b2c3d479"
    ]
  },
  "tenant_ids": {
    "project_id": 1,
    "organization_id": 1,
    "referrer": "some_referrer"
  }
}
